{
  "$schema": "https://json-schema.org/draft/2020-12/schema",
  "title": "config/toolchain.json",
  "description": "The toolchains that no other file of the checkout declares. Node.js is declared in .node-version, npm in packageManager of package.json, Rust in rust-toolchain.toml; php and python may also be declared in .php-version and .python-version.",
  "type": "object",
  "required": [
    "schema"
  ],
  "additionalProperties": false,
  "properties": {
    "schema": {
      "type": "integer",
      "const": 1
    },
    "comment": {
      "type": "string"
    },
    "php": {
      "description": "The PHP minor releases that the checks run on; a patch release of a listed minor passes.",
      "type": "array",
      "minItems": 1,
      "items": {
        "type": "string",
        "pattern": "^\\d+\\.\\d+$"
      }
    },
    "python": {
      "description": "The Python minor release of the checks; a patch release of the minor passes.",
      "type": "string",
      "pattern": "^\\d+\\.\\d+$"
    },
    "pythonBuild": {
      "description": "The exact Python release of the python minor. install-tools installs it with the uv of the declaration uv (uv python install), which downloads the python-build-standalone build that its release names and checks the build's sha256.",
      "type": "object",
      "required": [
        "version"
      ],
      "additionalProperties": false,
      "properties": {
        "version": {
          "type": "string",
          "pattern": "^\\d+\\.\\d+\\.\\d+$"
        }
      }
    },
    "pythonBackend": {
      "description": "The build backend of the Python wheels: the exact requirement of the wheel, and its sha256 from the PyPI release. install-tools downloads it into var/tools/wheels with the digest checked.",
      "type": "object",
      "required": [
        "requirement",
        "sha256"
      ],
      "additionalProperties": false,
      "properties": {
        "requirement": {
          "type": "string",
          "pattern": "^[A-Za-z0-9._-]+==\\d+(\\.\\d+)*$"
        },
        "sha256": {
          "type": "string",
          "pattern": "^[0-9a-f]{64}$"
        }
      }
    },
    "composer": {
      "description": "The Composer release. With sha256, install-tools installs composer.phar into var/tools; without it, the Composer of the machine is verified.",
      "type": "object",
      "required": [
        "version"
      ],
      "additionalProperties": false,
      "properties": {
        "version": {
          "type": "string",
          "pattern": "^\\d+\\.\\d+\\.\\d+$"
        },
        "sha256": {
          "type": "string",
          "pattern": "^[0-9a-f]{64}$"
        }
      }
    },
    "phpunit": {
      "description": "The PHPUnit release of the PHP tests of kit: install-tools installs the Composer project of config/phpunit (composer.json and composer.lock) into var/tools/phpunit with the declared Composer.",
      "type": "object",
      "required": [
        "version"
      ],
      "additionalProperties": false,
      "properties": {
        "version": {
          "type": "string",
          "pattern": "^\\d+\\.\\d+\\.\\d+$"
        }
      }
    },
    "go": {
      "description": "Where the Go release is declared: the go.mod that holds its toolchain line or go directive, and optionally a file that holds the exact release.",
      "type": "object",
      "required": [
        "mod"
      ],
      "additionalProperties": false,
      "properties": {
        "mod": {
          "type": "string",
          "pattern": "^([^/\\\\][^\\\\]*/)?go\\.mod$"
        },
        "versionFile": {
          "type": "string",
          "pattern": "^[^/][^\\\\]*$"
        }
      }
    },
    "ruff": {
      "description": "The ruff release that install-tools installs into a virtual environment of var/tools: the exact version, and the sha256 of the wheel of each platform key (process.platform-process.arch) that the install downloads, the digest read as 64 lowercase hexadecimal digits.",
      "type": "object",
      "required": [
        "version",
        "sha256"
      ],
      "additionalProperties": false,
      "properties": {
        "version": {
          "type": "string",
          "pattern": "^\\d+\\.\\d+\\.\\d+$"
        },
        "sha256": {
          "type": "object",
          "description": "The sha256 of the ruff wheel of each platform key; the install accepts a wheel of any listed digest and names the platform key of none."
        }
      }
    },
    "uv": {
      "description": "The uv release that install-tools installs into var/tools/uv: the exact version, and the sha256 of the archive uv-<target>.tar.gz of the GitHub release of each platform key (process.platform-process.arch), the digest read as 64 lowercase hexadecimal digits.",
      "type": "object",
      "required": [
        "version",
        "sha256"
      ],
      "additionalProperties": false,
      "properties": {
        "version": {
          "type": "string",
          "pattern": "^\\d+\\.\\d+\\.\\d+$"
        },
        "sha256": {
          "type": "object",
          "description": "The sha256 of the uv archive of each platform key; the install refuses an archive of another digest."
        }
      }
    },
    "cargoAudit": {
      "description": "The cargo-audit release that install-tools builds into var/tools/cargo-audit.",
      "type": "string",
      "pattern": "^\\d+\\.\\d+\\.\\d+$"
    },
    "govulncheck": {
      "description": "The govulncheck release that install-tools builds into var/tools/govulncheck.",
      "type": "string",
      "pattern": "^\\d+\\.\\d+\\.\\d+$"
    },
    "node": {
      "description": "The SHA-256 of the Node.js archive of the release in .node-version, for each platform that downloads it.",
      "type": "object",
      "additionalProperties": false,
      "properties": {
        "linux-x64.tar.gz": {
          "type": "string",
          "pattern": "^[0-9a-f]{64}$"
        },
        "linux-arm64.tar.gz": {
          "type": "string",
          "pattern": "^[0-9a-f]{64}$"
        },
        "darwin-x64.tar.gz": {
          "type": "string",
          "pattern": "^[0-9a-f]{64}$"
        },
        "darwin-arm64.tar.gz": {
          "type": "string",
          "pattern": "^[0-9a-f]{64}$"
        }
      }
    }
  }
}
