{
  "schema": 1,
  "comment": "The shape of a repository that lists PHP minors and declares every installed tool.",
  "php": ["8.2", "8.5"],
  "python": "3.14",
  "composer": { "version": "2.10.3" },
  "go": { "mod": "packages/fixture-go/go.mod" },
  "ruff": { "version": "0.16.10", "sha256": { "linux-x64": "f33f43a864a8483eebd160e713336c8bab02c934feaff0a33cf5ccb41546d09a", "darwin-arm64": "3031a4a2e8e7b8a46f70be45f198c35a11ece509a94b80334d8d397a33c67550" } },
  "cargoAudit": "0.22.2",
  "govulncheck": "1.1.4",
  "node": {
    "linux-x64.tar.gz": "b2b76660fa4ded4e0b2a41ee3c0c651cd52ea8170ead91ebac1e147ac3d55643",
    "darwin-arm64.tar.gz": "0000000000000000000000000000000000000000000000000000000000000000"
  }
}
